{
  "$schema": "https://json-schema.org/draft/2020-12/schema",
  "$id": "https://github.com/gascarcella/psxstack/schema/game.schema.json",
  "title": "psxstack game description",
  "description": "Static facts about a game, read at configure time by psxstack_add_game() and generated into psxstack_game_gen.h. Nothing reads it at run time. GAME_CONTRACT.md \"1. game.json\". Addresses and sizes are hex strings (\"0x80082CB0\") or integers.",
  "type": "object",
  "additionalProperties": false,
  "required": ["schema", "id", "title", "discs", "video", "memory"],
  "$defs": {
    "address": {
      "description": "A PS1 address or a byte count: a hex string or an integer.",
      "oneOf": [{ "type": "string", "pattern": "^0x[0-9A-Fa-f]{1,8}$" }, { "type": "integer", "minimum": 0 }]
    },
    "identifier": { "type": "string", "pattern": "^[a-z][a-z0-9_]{0,31}$" }
  },
  "properties": {
    "schema": { "const": 1 },
    "id": {
      "$ref": "#/$defs/identifier",
      "description": "The game's short name: the port executable (<id>, <id>.exe), the launcher (<id>-launcher), the per-user settings directory (SDL_GetPrefPath('', id)), the cache directory (<id>-port), the data section prefix (<id>_data_<overlay>)."
    },
    "title": { "type": "string", "minLength": 1, "description": "The game's title as shown: window titles, the launcher, the packages." },
    "env_prefix": {
      "type": "string", "pattern": "^[A-Z][A-Z0-9]{0,15}$",
      "description": "Environment variables: <PREFIX>_CONFIG_DIR, <PREFIX>_GAME, <PREFIX>_MCP_GAME, ... Default: id upper-cased."
    },
    "discs": {
      "type": "array",
      "description": "The disc images the port accepts. The port and the launcher check the whole BIN's SHA-1 against this list; the error names the labels. Empty for a disc-free program (examples/hello): the port then takes no --disc and the launcher has no disc screen to pass.",
      "items": {
        "type": "object", "additionalProperties": false,
        "required": ["label", "serial", "sha1", "size", "region"],
        "properties": {
          "label": { "type": "string", "description": "A noun phrase for the messages, completing \"This is <label>.\" and \"<file> is not <label>\": \"the unpatched European disc (SLES-03936)\"." },
          "serial": { "type": "string", "pattern": "^[A-Z]{4}-[0-9]{5}$" },
          "sha1": { "type": "string", "pattern": "^[0-9a-f]{40}$", "description": "Of the whole BIN (every sector, 2352 bytes each)." },
          "size": { "type": "integer", "minimum": 1, "description": "The BIN's size in bytes." },
          "region": { "enum": ["PAL", "NTSC-U", "NTSC-J"] },
          "cue": { "type": "string", "description": "The expected .cue file name, for the launcher's hint. Optional." }
        }
      }
    },
    "disc_required": {
      "type": "boolean",
      "description": "The game cannot run without its disc (its reads would find no data): the port then refuses to start without one (--disc or the settings' disc.path), with a message and status 64, except for --input-test and the modes that exit before the run. Default false. Needs a non-empty `discs`."
    },
    "video": {
      "type": "object", "additionalProperties": false, "required": ["rate"],
      "properties": {
        "rate": { "enum": [50, 60], "description": "The nominal vsyncs per second the game is made for (the audio's samples per vsync follow it)." },
        "rates": {
          "type": "array", "items": { "enum": [50, 60] }, "uniqueItems": true,
          "description": "The rates the launcher offers (default: [rate]). A rate other than `rate` is passed to the game's game_apply_rate()."
        },
        "rate_note": { "type": "string", "description": "The launcher's explanation of the alternative rate (dw2003: the NTSC patch's 60 Hz mode)." },
        "scenes": {
          "type": "object", "additionalProperties": false, "required": ["2d", "3d"],
          "description": "Opt-in: two present-filter sets (a filter and its crt values), one for the game's 2D scenes and one for its 3D scenes, which the runtime switches between as the adapter's game_state_scene() says. Absent: one set, as before. The settings' video.filter and video.crt are the 3D set, video.scene_2d the 2D set.",
          "properties": {
            "2d": {
              "type": "object", "additionalProperties": false, "required": ["label"],
              "properties": {
                "label": { "type": "string", "minLength": 1, "description": "What the 2D scenes are, for the launcher's filter tab (its first letter capitalised): \"the field and the menus\"." },
                "filter": { "enum": ["none", "sharp", "scanlines", "crt", "smooth"], "description": "The 2D set's default filter (with the default crt values). Absent: a copy of the 3D set." }
              }
            },
            "3d": {
              "type": "object", "additionalProperties": false, "required": ["label"],
              "properties": {
                "label": { "type": "string", "minLength": 1, "description": "What the 3D scenes are, for the launcher's filter tab (its first letter capitalised): \"battles\"." }
              }
            }
          }
        }
      }
    },
    "memory": {
      "type": "object", "additionalProperties": false, "required": ["ram", "slots"],
      "properties": {
        "ram": {
          "type": "object", "additionalProperties": false, "required": ["base", "size"],
          "properties": { "base": { "$ref": "#/$defs/address" }, "size": { "$ref": "#/$defs/address" } },
          "description": "The PS1's RAM as the game addresses it: 0x80000000, 0x200000 (KSEG0). An address outside it is a host pointer to the overlay resolver."
        },
        "slots": {
          "type": "array", "minItems": 1, "maxItems": 8,
          "description": "The overlay slots in address order, contiguous with each other and with the heap: the arena is laid out at these distances so a pointer's PS1-style address is slots[0].base + its offset. Slot n (1-based) is `tier` n in the hook macros.",
          "items": {
            "type": "object", "additionalProperties": false, "required": ["name", "base", "size"],
            "properties": {
              "name": { "$ref": "#/$defs/identifier", "description": "For logs and the generated macros' comments: \"stage\", \"file\"." },
              "base": { "$ref": "#/$defs/address" },
              "size": { "$ref": "#/$defs/address" }
            }
          }
        },
        "heap": {
          "type": "object", "additionalProperties": false, "required": ["start", "end"],
          "description": "The heap the stack manages in the arena, right after the last slot (the HEAP_* hook macros). Optional: a game whose heap is its own data (an array in its .bss, as the second game's) leaves it out; the arena then holds the slots alone, and a use of a HEAP_* macro fails to compile.",
          "properties": {
            "start": { "$ref": "#/$defs/address", "description": "The PS1 heap's first address (right after the last slot)." },
            "end": { "$ref": "#/$defs/address", "description": "The PS1 heap's end (exclusive)." },
            "host_size": { "$ref": "#/$defs/address", "description": "The host heap region's size; larger than the PS1's because 64-bit structs grow. Default 0x400000." }
          }
        },
        "bios_standin": {
          "type": "array",
          "description": "Reads the game makes from the BIOS ROM (0x1FC00000..): the stand-in holds `text` at `address`.",
          "items": {
            "type": "object", "additionalProperties": false, "required": ["address", "text"],
            "properties": { "address": { "$ref": "#/$defs/address" }, "text": { "type": "string" } }
          }
        }
      }
    },
    "launcher": {
      "type": "object", "additionalProperties": false,
      "properties": {
        "about": { "type": "string", "description": "One line under the title: \"Digimon World 2003 (Europe, SLES-03936) on the PC port.\"" },
        "disc_hint": { "type": "string", "description": "The launcher's disc screen: what the game needs, one or two sentences (\"Nothing is unpacked or copied.\" is added)." },
        "website": { "type": "string", "format": "uri" },
        "updates": {
          "type": "object", "additionalProperties": false, "required": ["github"],
          "description": "The launcher's update check (docs/LAUNCHER.md \"Updates\"): the GitHub repository whose latest release is compared with the launcher's version stamp. Absent: no check, no network call. The release's packages are named as GAME_CONTRACT.md \"Releases\" says.",
          "properties": {
            "github": { "type": "string", "pattern": "^[A-Za-z0-9_.-]+/[A-Za-z0-9_.-]+$", "description": "owner/repo: \"gascarcella/dw2003recomp\"." }
          }
        },
        "steam_art": {
          "type": "object", "additionalProperties": false, "minProperties": 1,
          "description": "The pictures Add to Steam puts beside the game's shortcut (docs/LAUNCHER.md \"Steam\"), each a PNG path relative to this file, embedded in the launcher at build time. Absent: Steam's own placeholders.",
          "properties": {
            "capsule": { "type": "string", "description": "The library's portrait capsule (600x900): <appid>p.png." },
            "wide_capsule": { "type": "string", "description": "The wide capsule (920x430): <appid>.png." },
            "hero": { "type": "string", "description": "The game page's banner (3840x1240): <appid>_hero.png." },
            "logo": { "type": "string", "description": "The logo over the hero, transparent (about 1280x720): <appid>_logo.png." },
            "icon": { "type": "string", "description": "The icon, square (256x256): <appid>_icon.png, also the shortcut's icon." }
          }
        }
      }
    }
  }
}
